Title,Published,Authors,Abstract,Link
"Characterizing climate pathways using feature importance on echo state
  networks",2023-10-12T16:55:04Z,"Katherine Goode, Daniel Ries, Kellie McClernon","The 2022 National Defense Strategy of the United States listed climate change
as a serious threat to national security. Climate intervention methods, such as
stratospheric aerosol injection, have been proposed as mitigation strategies,
but the downstream effects of such actions on a complex climate system are not
well understood. The development of algorithmic techniques for quantifying
relationships between source and impact variables related to a climate event
(i.e., a climate pathway) would help inform policy decisions. Data-driven deep
learning models have become powerful tools for modeling highly nonlinear
relationships and may provide a route to characterize climate variable
relationships. In this paper, we explore the use of an echo state network (ESN)
for characterizing climate pathways. ESNs are a computationally efficient
neural network variation designed for temporal data, and recent work proposes
ESNs as a useful tool for forecasting spatio-temporal climate data. Like other
neural networks, ESNs are non-interpretable black-box models, which poses a
hurdle for understanding variable relationships. We address this issue by
developing feature importance methods for ESNs in the context of
spatio-temporal data to quantify variable relationships captured by the model.
We conduct a simulation study to assess and compare the feature importance
techniques, and we demonstrate the approach on reanalysis climate data. In the
climate application, we select a time period that includes the 1991 volcanic
eruption of Mount Pinatubo. This event was a significant stratospheric aerosol
injection, which we use as a proxy for an artificial stratospheric aerosol
injection. Using the proposed approach, we are able to characterize
relationships between pathway variables associated with this event.",http://arxiv.org/abs/2310.08495v1
AI for Anticipatory Action: Moving Beyond Climate Forecasting,2023-07-28T17:32:59Z,"Benjamin Q. Huynh, Mathew V. Kiang","Disaster response agencies have been shifting from a paradigm of climate
forecasting towards one of anticipatory action: assessing not just what the
climate will be, but how it will impact specific populations, thereby enabling
proactive response and resource allocation. Machine learning models are
becoming exceptionally powerful at climate forecasting, but methodological gaps
remain in terms of facilitating anticipatory action. Here we provide an
overview of anticipatory action, review relevant applications of machine
learning, identify common challenges, and highlight areas where machine
learning can uniquely contribute to advancing disaster response for populations
most vulnerable to climate change.",http://arxiv.org/abs/2307.15727v1
"Southern Ocean Dynamics Under Climate Change: New Knowledge Through
  Physics-Guided Machine Learning",2023-10-21T06:13:19Z,"William Yik, Maike Sonnewald, Mariana C. A. Clare, Redouane Lguensat","Complex ocean systems such as the Antarctic Circumpolar Current play key
roles in the climate, and current models predict shifts in their strength and
area under climate change. However, the physical processes underlying these
changes are not well understood, in part due to the difficulty of
characterizing and tracking changes in ocean physics in complex models. Using
the Antarctic Circumpolar Current as a case study, we extend the method
Tracking global Heating with Ocean Regimes (THOR) to a mesoscale eddy
permitting climate model and identify regions of the ocean characterized by
similar physics, called dynamical regimes, using readily accessible fields from
climate models. To this end, we cluster grid cells into dynamical regimes and
train an ensemble of neural networks, allowing uncertainty quantification, to
predict these regimes and track them under climate change. Finally, we leverage
this new knowledge to elucidate the dynamical drivers of the identified regime
shifts as noted by the neural network using the 'explainability' methods SHAP
and Layer-wise Relevance Propagation. A region undergoing a profound shift is
where the Antarctic Circumpolar Current intersects the Pacific-Antarctic Ridge,
an area important for carbon draw-down and fisheries. In this region, THOR
specifically reveals a shift in dynamical regime under climate change driven by
changes in wind stress and interactions with bathymetry. Using this knowledge
to guide further exploration, we find that as the Antarctic Circumpolar Current
shifts north under intensifying wind stress, the dominant dynamical role of
bathymetry weakens and the flow intensifies.",http://arxiv.org/abs/2310.13916v2
"Analysis of Climate Campaigns on Social Media using Bayesian Model
  Averaging",2023-05-06T16:43:29Z,"Tunazzina Islam, Ruqi Zhang, Dan Goldwasser","Climate change is the defining issue of our time, and we are at a defining
moment. Various interest groups, social movement organizations, and individuals
engage in collective action on this issue on social media. In addition, issue
advocacy campaigns on social media often arise in response to ongoing societal
concerns, especially those faced by energy industries. Our goal in this paper
is to analyze how those industries, their advocacy group, and climate advocacy
group use social media to influence the narrative on climate change. In this
work, we propose a minimally supervised model soup [57] approach combined with
messaging themes to identify the stances of climate ads on Facebook. Finally,
we release our stance dataset, model, and set of themes related to climate
campaigns for future work on opinion mining and the automatic detection of
climate change stances.",http://arxiv.org/abs/2305.06174v2
"CMIP X-MOS: Improving Climate Models with Extreme Model Output
  Statistics",2023-10-24T13:18:53Z,"Vsevolod Morozov, Artem Galliamov, Aleksandr Lukashevich, Antonina Kurdukova, Yury Maximov","Climate models are essential for assessing the impact of greenhouse gas
emissions on our changing climate and the resulting increase in the frequency
and severity of natural disasters. Despite the widespread acceptance of climate
models produced by the Coupled Model Intercomparison Project (CMIP), they still
face challenges in accurately predicting climate extremes, which pose most
significant threats to both people and the environment. To address this
limitation and improve predictions of natural disaster risks, we introduce
Extreme Model Output Statistics (X-MOS). This approach utilizes deep regression
techniques to precisely map CMIP model outputs to real measurements obtained
from weather stations, which results in a more accurate analysis of the XXI
climate extremes. In contrast to previous research, our study places a strong
emphasis on enhancing the estimation of the tails of future climate parameter
distributions. The latter supports decision-makers, enabling them to better
assess climate-related risks across the globe.",http://arxiv.org/abs/2311.03370v1
"""The main message is that sustainability would help"" -- Reflections on
  takeaway messages of climate change data visualizations",2023-05-06T12:33:11Z,"Regina Schuster, Laura Koesten, Kathleen Gregory, Torsten Möller","How do different audiences make sense of climate change data visualizations
and what do they take away as a main message? To investigate this question, we
are building on the results of a previous study, focusing on expert opinions
regarding public climate change communication and the role of data
visualizations. Hereby, we conducted semi-structured interviews with 17 experts
in the fields of climate change, science communication, or data visualization.
We also interviewed six lay persons with no professional background in either
of these areas. With this analysis, we aim to shed light on how lay audiences
arrive at an understanding of climate change data visualizations and what they
take away as a main message. For two exemplary data visualizations, we compare
their takeaway messages with messages formulated by experts. Through a thematic
analysis, we observe differences regarding the included contents, the length
and abstraction of messages, and the sensemaking process between and among the
participant groups.",http://arxiv.org/abs/2305.04030v1
Detecting changepoints in globally-indexed functional time series,2023-08-11T02:45:12Z,"Drew Yarger, J. Derek Tucker","In environmental and climate data, there is often an interest in determining
if and when changes occur in a system. Such changes may result from localized
sources in space and time like a volcanic eruption or climate geoengineering
events. Detecting such events and their subsequent influence on climate has
important policy implications. However, the climate system is complex, and such
changes can be challenging to detect. One statistical perspective for
changepoint detection is functional time series, where one observes an entire
function at each time point. We will consider the context where each time point
is a year, and we observe a function of temperature indexed by day of the year.
Furthermore, such data is measured at many spatial locations on Earth, which
motivates accommodating sets of functional time series that are
spatially-indexed on a sphere. Simultaneously inferring changes that can occur
at different times for different locations is challenging. We propose test
statistics for detecting these changepoints, and we evaluate performance using
varying levels of data complexity, including a simulation study, simplified
climate model simulations, and climate reanalysis data. We evaluate changes in
stratospheric temperature globally over 1984-1998. Such changes may be
associated with the eruption of Mt. Pinatubo in 1991.",http://arxiv.org/abs/2308.05915v1
"How Do US Congress Members Advertise Climate Change: An Analysis Of Ads
  Run On Meta's Platforms",2023-04-06T17:58:41Z,"Laurenz Aisenpreis, Gustav Gyrst, Vedran Sekara","Ensuring transparency and integrity in political communication on climate
change has arguably never been more important than today. Yet we know little
about how politicians focus on, talk about, and portray climate change on
social media. Here we study it from the perspective of political advertisement.
We use Meta's Ad Library to collect 602,546 ads that have been issued by US
Congress members since mid-2018. Out of those only 19,176 (3.2%) are
climate-related. Analyzing this data, we find that Democrats focus
substantially more on climate change than Republicans, with 99.7% of all
climate-related ads stemming from Democratic politicians. In particular, we
find this is driven by a small core of Democratic politicians, where 72% of all
impressions can be attributed to 10 politicians. Interestingly, we find a
significant difference in the average amount of impressions generated per
dollar spent between the two parties. Republicans generate on average 188% more
impressions with their climate ads for the same money spent as Democrats. We
build models to explain the differences and find that demographic factors only
partially explain the variance. Our results demonstrate differences of
climate-related advertisements of US congress members and reveal differences in
advertising characteristics between the two political parties. We anticipate
our work to be a starting point for further studies about climate-related ads
on Meta's platforms.",http://arxiv.org/abs/2304.03278v1
"Factors other than climate change are currently more important in
  predicting how well fruit farms are doing financially",2023-01-11T18:22:31Z,"Fabian Obster, Heidi Bohle, Paul M. Pechan","Machine learning and statistical modeling methods were used to analyze the
impact of climate change on financial wellbeing of fruit farmers in Tunisia and
Chile. The analysis was based on face to face interviews with 801 farmers.
Three research questions were investigated. First, whether climate change
impacts had an effect on how well the farm was doing financially. Second, if
climate change was not influential, what factors were important for predicting
financial wellbeing of the farm. And third, ascertain whether observed effects
on the financial wellbeing of the farm were a result of interactions between
predictor variables. This is the first report directly comparing climate change
with other factors potentially impacting financial wellbeing of farms. Certain
climate change factors, namely increases in temperature and reductions in
precipitation, can regionally impact self-perceived financial wellbeing of
fruit farmers. Specifically, increases in temperature and reduction in
precipitation can have a measurable negative impact on the financial wellbeing
of farms in Chile. This effect is less pronounced in Tunisia. Climate impact
differences were observed within Chile but not in Tunisia. However, climate
change is only of minor importance for predicting farm financial wellbeing,
especially for farms already doing financially well. Factors that are more
important, mainly in Tunisia, included trust in information sources and prior
farm ownership. Other important factors include farm size, water management
systems used and diversity of fruit crops grown. Moreover, some of the
important factors identified differed between farms doing and not doing well
financially. Interactions between factors may improve or worsen farm financial
wellbeing.",http://arxiv.org/abs/2301.07685v1
"Deep Ensembles to Improve Uncertainty Quantification of Statistical
  Downscaling Models under Climate Change Conditions",2023-04-27T19:53:18Z,"Jose González-Abad, Jorge Baño-Medina","Recently, deep learning has emerged as a promising tool for statistical
downscaling, the set of methods for generating high-resolution climate fields
from coarse low-resolution variables. Nevertheless, their ability to generalize
to climate change conditions remains questionable, mainly due to the
stationarity assumption. We propose deep ensembles as a simple method to
improve the uncertainty quantification of statistical downscaling models. By
better capturing uncertainty, statistical downscaling models allow for superior
planning against extreme weather events, a source of various negative social
and economic impacts. Since no observational future data exists, we rely on a
pseudo reality experiment to assess the suitability of deep ensembles for
quantifying the uncertainty of climate change projections. Deep ensembles allow
for a better risk assessment, highly demanded by sectoral applications to
tackle climate change.",http://arxiv.org/abs/2305.00975v1
AI For Global Climate Cooperation 2023 Competition Proceedings,2023-07-10T20:05:42Z,"Yoshua Bengio, Prateek Gupta, Lu Li, Soham Phade, Sunil Srinivasa, Andrew Williams, Tianyu Zhang, Yang Zhang, Stephan Zheng","The international community must collaborate to mitigate climate change and
sustain economic growth. However, collaboration is hard to achieve, partly
because no global authority can ensure compliance with international climate
agreements. Combining AI with climate-economic simulations offers a promising
solution to design international frameworks, including negotiation protocols
and climate agreements, that promote and incentivize collaboration. In
addition, these frameworks should also have policy goals fulfillment, and
sustained commitment, taking into account climate-economic dynamics and
strategic behaviors. These challenges require an interdisciplinary approach
across machine learning, economics, climate science, law, policy, ethics, and
other fields.
  Towards this objective, we organized AI for Global Climate Cooperation, a
Mila competition in which teams submitted proposals and analyses of
international frameworks, based on (modifications of) RICE-N, an AI-driven
integrated assessment model (IAM). In particular, RICE-N supports modeling
regional decision-making using AI agents. Furthermore, the IAM then models the
climate-economic impact of those decisions into the future.
  Whereas the first track focused only on performance metrics, the proposals
submitted to the second track were evaluated both quantitatively and
qualitatively. The quantitative evaluation focused on a combination of (i) the
degree of mitigation of global temperature rise and (ii) the increase in
economic productivity. On the other hand, an interdisciplinary panel of human
experts in law, policy, sociology, economics and environmental science,
evaluated the solutions qualitatively. In particular, the panel considered the
effectiveness, simplicity, feasibility, ethics, and notions of climate justice
of the protocols. In the third track, the participants were asked to critique
and improve RICE-N.",http://arxiv.org/abs/2307.06951v1
"Rediscover Climate Change during Global Warming Slowdown via Wasserstein
  Stability Analysis",2023-03-29T18:16:21Z,"Zhiang Xie, Dongwei Chen, Puxi Li","Climate change is one of the key topics in climate science. However, previous
research has predominantly concentrated on changes in mean values, and few
research examines changes in Probability Distribution Function (PDF). In this
study, a novel method called Wasserstein Stability Analysis (WSA) is developed
to identify PDF changes, especially the extreme event shift and non-linear
physical value constraint variation in climate change. WSA is applied to
21st-century warming slowdown period and is compared with traditional
mean-value trend analysis. The result indicates that despite no significant
trend, the central-eastern Pacific experienced a decline in hot extremes and an
increase in cold extremes, indicating a La Nina-like temperature shift. Further
analysis at two Arctic locations suggests sea ice severely restricts the hot
extremes of surface air temperature. This impact is diminishing as sea ice
melts. Overall, based on detecting PDF changes, WSA is a useful method for
re-discovering climate change.",http://arxiv.org/abs/2303.18067v2
"A Deep Learning Analysis of Climate Change, Innovation, and Uncertainty",2023-10-19T23:58:28Z,"Michael Barnett, William Brock, Lars Peter Hansen, Ruimeng Hu, Joseph Huang","We study the implications of model uncertainty in a climate-economics
framework with three types of capital: ""dirty"" capital that produces carbon
emissions when used for production, ""clean"" capital that generates no emissions
but is initially less productive than dirty capital, and knowledge capital that
increases with R\&D investment and leads to technological innovation in green
sector productivity. To solve our high-dimensional, non-linear model framework
we implement a neural-network-based global solution method. We show there are
first-order impacts of model uncertainty on optimal decisions and social
valuations in our integrated climate-economic-innovation framework. Accounting
for interconnected uncertainty over climate dynamics, economic damages from
climate change, and the arrival of a green technological change leads to
substantial adjustments to investment in the different capital types in
anticipation of technological change and the revelation of climate damage
severity.",http://arxiv.org/abs/2310.13200v1
"HAiVA: Hybrid AI-assisted Visual Analysis Framework to Study the Effects
  of Cloud Properties on Climate Patterns",2023-05-13T07:55:47Z,"Subhashis Hazarika, Haruki Hirasawa, Sookyung Kim, Kalai Ramea, Salva R. Cachay, Peetak Mitra, Dipti Hingmire, Hansi Singh, Phil J. Rasch","Clouds have a significant impact on the Earth's climate system. They play a
vital role in modulating Earth's radiation budget and driving regional changes
in temperature and precipitation. This makes clouds ideal for climate
intervention techniques like Marine Cloud Brightening (MCB) which refers to
modification in cloud reflectivity, thereby cooling the surrounding region.
However, to avoid unintended effects of MCB, we need a better understanding of
the complex cloud to climate response function. Designing and testing such
interventions scenarios with conventional Earth System Models is
computationally expensive. Therefore, we propose a hybrid AI-assisted visual
analysis framework to drive such scientific studies and facilitate interactive
what-if investigation of different MCB intervention scenarios to assess their
intended and unintended impacts on climate patterns. We work with a team of
climate scientists to develop a suite of hybrid AI models emulating
cloud-climate response function and design a tightly coupled frontend
interactive visual analysis system to perform different MCB intervention
experiments.",http://arxiv.org/abs/2305.07859v1
"Multifractal and recurrence measures from meteorological data of climate
  zones in India",2023-07-03T17:17:49Z,"Joshin John Bejoy, Jayesh Dave, G. Ambika","We present a study on the spatio-temporal pattern underlying the climate
dynamics in various locations spread over India, including the Himalayan
region, coastal region, central and northeastern parts of India. We try to
capture the variations in the complexity of their dynamics derived from
temperature and relative humidity data and classify them based on the
multifractal features of their reconstructed phase space dynamics. We also
report the variations in climate dynamics over time in these locations by
estimating the recurrence-based measures using a sliding window analysis on the
data sets. We could then detect significant shifts in climate variability in
different spatial locations during the period 1970-2000. The dynamical systems
approach presented thus helps to understand the complexity and identify the
heterogeneity in climate dynamics. The study also provides relevant inputs on
the nature of the shifts in climate that occur in the locations spread over
different climate zones.",http://arxiv.org/abs/2307.01165v3
Multi-variable Hard Physical Constraints for Climate Model Downscaling,2023-08-02T11:42:02Z,"Jose González-Abad, Álex Hernández-García, Paula Harder, David Rolnick, José Manuel Gutiérrez","Global Climate Models (GCMs) are the primary tool to simulate climate
evolution and assess the impacts of climate change. However, they often operate
at a coarse spatial resolution that limits their accuracy in reproducing
local-scale phenomena. Statistical downscaling methods leveraging deep learning
offer a solution to this problem by approximating local-scale climate fields
from coarse variables, thus enabling regional GCM projections. Typically,
climate fields of different variables of interest are downscaled independently,
resulting in violations of fundamental physical properties across
interconnected variables. This study investigates the scope of this problem
and, through an application on temperature, lays the foundation for a framework
introducing multi-variable hard constraints that guarantees physical
relationships between groups of downscaled climate variables.",http://arxiv.org/abs/2308.01868v1
Towards Causal Representations of Climate Model Data,2023-12-05T16:13:34Z,"Julien Boussard, Chandni Nagda, Julia Kaltenborn, Charlotte Emilie Elektra Lange, Philippe Brouillard, Yaniv Gurwicz, Peer Nowack, David Rolnick","Climate models, such as Earth system models (ESMs), are crucial for
simulating future climate change based on projected Shared Socioeconomic
Pathways (SSP) greenhouse gas emissions scenarios. While ESMs are sophisticated
and invaluable, machine learning-based emulators trained on existing simulation
data can project additional climate scenarios much faster and are
computationally efficient. However, they often lack generalizability and
interpretability. This work delves into the potential of causal representation
learning, specifically the \emph{Causal Discovery with Single-parent Decoding}
(CDSD) method, which could render climate model emulation efficient
\textit{and} interpretable. We evaluate CDSD on multiple climate datasets,
focusing on emissions, temperature, and precipitation. Our findings shed light
on the challenges, limitations, and promise of using CDSD as a stepping stone
towards more interpretable and robust climate model emulation.",http://arxiv.org/abs/2312.02858v2
"Dynamic Grouping for Climate Change Negotiation: Facilitating
  Cooperation and Balancing Interests through Effective Strategies",2023-07-26T01:34:43Z,"Yu Qin, Duo Zhang, Yuren Pang","In this paper, we propose a dynamic grouping negotiation model for climate
mitigation based on real-world business and political negotiation protocols.
Within the AI4GCC competition framework, we develop a three-stage process:
group formation and updates, intra-group negotiation, and inter-group
negotiation. Our model promotes efficient and effective cooperation between
various stakeholders to achieve global climate change objectives. By
implementing a group-forming method and group updating strategy, we address the
complexities and imbalances in multi-region climate negotiations. Intra-group
negotiations ensure that all members contribute to mitigation efforts, while
inter-group negotiations use the proposal-evaluation framework to set
mitigation and savings rates. We demonstrate our negotiation model within the
RICE-N framework, illustrating a promising approach for facilitating
international cooperation on climate change mitigation.",http://arxiv.org/abs/2307.13893v1
