Title,Published,Authors,Abstract,Link
Baumol's Climate Disease,2023-11-30T19:45:13Z,"Fangzhi Wang, Hua Liao, Richard S. J. Tol","We investigate optimal carbon abatement in a dynamic general equilibrium
climate-economy model with endogenous structural change. By differentiating the
production of investment from consumption, we show that social cost of carbon
can be conceived as a reduction in physical capital. In addition, we
distinguish two final sectors in terms of productivity growth and climate
vulnerability. We theoretically show that heterogeneous climate vulnerability
results in a climate-induced version of Baumol's cost disease. Further, if
climate-vulnerable sectors have high (low) productivity growth, climate impact
can either ameliorate (aggravate) the Baumol's cost disease, call for less
(more) stringent climate policy. We conclude that carbon abatement should not
only factor in unpriced climate capital, but also be tailored to Baumol's cost
and climate diseases.",http://arxiv.org/abs/2312.00160v1
Hurricanes Increase Climate Change Conversations on Twitter,2023-05-12T14:46:26Z,"Maddalena Torricelli, Max Falkenberg, Alessandro Galeazzi, Fabiana Zollo, Walter Quattrociocchi, Andrea Baronchelli","The public understanding of climate change plays a critical role in
translating climate science into climate action. In the public discourse,
climate impacts are often discussed in the context of extreme weather events.
Here, we analyse 65 million Twitter posts and 240 thousand news media articles
related to 18 major hurricanes from 2010 to 2022 to clarify how hurricanes
impact the public discussion around climate change. First, we analyse news
content and show that climate change is the most prominent non-hurricane
specific topic discussed by the news media in relation to hurricanes. Second,
we perform a comparative analysis between reliable and questionable news media
outlets, finding that the language around climate change varies between news
media providers. Finally, using geolocated data, we show that accounts in
regions affected by hurricanes discuss climate change at a significantly higher
rate than accounts in unaffected areas, with references to climate change
increasing by, on average, 80% after impact, and up to 200% for the largest
hurricanes. Our findings demonstrate how hurricanes have a key impact on the
public awareness of climate change.",http://arxiv.org/abs/2305.07529v1
ClimateSet: A Large-Scale Climate Model Dataset for Machine Learning,2023-11-07T04:55:36Z,"Julia Kaltenborn, Charlotte E. E. Lange, Venkatesh Ramesh, Philippe Brouillard, Yaniv Gurwicz, Chandni Nagda, Jakob Runge, Peer Nowack, David Rolnick","Climate models have been key for assessing the impact of climate change and
simulating future climate scenarios. The machine learning (ML) community has
taken an increased interest in supporting climate scientists' efforts on
various tasks such as climate model emulation, downscaling, and prediction
tasks. Many of those tasks have been addressed on datasets created with single
climate models. However, both the climate science and ML communities have
suggested that to address those tasks at scale, we need large, consistent, and
ML-ready climate model datasets. Here, we introduce ClimateSet, a dataset
containing the inputs and outputs of 36 climate models from the Input4MIPs and
CMIP6 archives. In addition, we provide a modular dataset pipeline for
retrieving and preprocessing additional climate models and scenarios. We
showcase the potential of our dataset by using it as a benchmark for ML-based
climate model emulation. We gain new insights about the performance and
generalization capabilities of the different ML models by analyzing their
performance across different climate models. Furthermore, the dataset can be
used to train an ML emulator on several climate models instead of just one.
Such a ""super emulator"" can quickly project new climate change scenarios,
complementing existing scenarios already provided to policymakers. We believe
ClimateSet will create the basis needed for the ML community to tackle
climate-related tasks at scale.",http://arxiv.org/abs/2311.03721v1
Leveraging machine learning to enhance climate models: a review,2023-11-15T22:30:32Z,"Ahmed Elsayed, Shrouk Wally, Islam Alkabbany, Asem Ali, Aly Farag","Recent achievements in machine learning (Ml) have had a significant impact on
various fields, including climate science. Climate modeling is very important
and plays a crucial role in shaping the decisions of governments and
individuals in mitigating the impact of climate change. Climate change poses a
serious threat to humanity, however, current climate models are limited by
computational costs, uncertainties, and biases, affecting their prediction
accuracy. The vast amount of climate data generated by satellites, radars, and
earth system models (ESMS) poses a significant challenge. ML techniques can be
effectively employed to analyze this data and extract valuable insights that
aid in our understanding of the earth climate. This review paper focuses on how
ml has been utilized in the last 5 years to boost the current state-of-the-art
climate models. We invite the ml community to join in the global effort to
accurately model the earth climate by collaborating with other fields to
leverage ml as a powerful tool in this endeavor.",http://arxiv.org/abs/2311.09413v1
"Understanding the Impact of Seasonal Climate Change on Canada's Economy
  by Region and Sector",2023-11-06T20:12:07Z,"Shiyu He, Trang Bui, Yuying Huang, Wenling Zhang, Jie Jian, Samuel W. K. Wong, Tony S. Wirjanto","To assess the impact of climate change on the Canadian economy, we
investigate and model the relationship between seasonal climate variables and
economic growth across provinces and economic sectors. We further provide
projections of climate change impacts up to the year 2050, taking into account
the diverse climate change patterns and economic conditions across Canada. Our
results indicate that rising Fall temperature anomalies have a notable adverse
impact on Canadian economic growth. Province-wide, Saskatchewan and Manitoba
are anticipated to experience the most substantial declines, whereas British
Columbia and the Maritime provinces will be less impacted. Industry-wide,
Mining is projected to see the greatest benefits, while Agriculture and
Manufacturing are projected to have the most significant downturns. The
disparities of climate change effects between provinces and industries
highlight the need for governments to tailor their policies accordingly, and
offer targeted assistance to regions and industries that are particularly
vulnerable in the face of climate change. Targeted approaches to climate change
mitigation are likely to be more effective than one-size-fits-all policies for
the whole economy.",http://arxiv.org/abs/2311.03497v1
"ClimateNLP: Analyzing Public Sentiment Towards Climate Change Using
  Natural Language Processing",2023-10-12T07:48:50Z,"Ajay Krishnan, V. S. Anoop","Climate change's impact on human health poses unprecedented and diverse
challenges. Unless proactive measures based on solid evidence are implemented,
these threats will likely escalate and continue to endanger human well-being.
The escalating advancements in information and communication technologies have
facilitated the widespread availability and utilization of social media
platforms. Individuals utilize platforms such as Twitter and Facebook to
express their opinions, thoughts, and critiques on diverse subjects,
encompassing the pressing issue of climate change. The proliferation of climate
change-related content on social media necessitates comprehensive analysis to
glean meaningful insights. This paper employs natural language processing (NLP)
techniques to analyze climate change discourse and quantify the sentiment of
climate change-related tweets. We use ClimateBERT, a pretrained model
fine-tuned specifically for the climate change domain. The objective is to
discern the sentiment individuals express and uncover patterns in public
opinion concerning climate change. Analyzing tweet sentiments allows a deeper
comprehension of public perceptions, concerns, and emotions about this critical
global challenge. The findings from this experiment unearth valuable insights
into public sentiment and the entities associated with climate change
discourse. Policymakers, researchers, and organizations can leverage such
analyses to understand public perceptions, identify influential actors, and
devise informed strategies to address climate change challenges.",http://arxiv.org/abs/2310.08099v2
Climate Change from Large Language Models,2023-12-19T09:26:46Z,"Hongyin Zhu, Prayag Tiwari","Climate change poses grave challenges, demanding widespread understanding and
low-carbon lifestyle awareness. Large language models (LLMs) offer a powerful
tool to address this crisis, yet comprehensive evaluations of their
climate-crisis knowledge are lacking. This paper proposes an automated
evaluation framework to assess climate-crisis knowledge within LLMs. We adopt a
hybrid approach for data acquisition, combining data synthesis and manual
collection, to compile a diverse set of questions encompassing various aspects
of climate change. Utilizing prompt engineering based on the compiled
questions, we evaluate the model's knowledge by analyzing its generated
answers. Furthermore, we introduce a comprehensive set of metrics to assess
climate-crisis knowledge, encompassing indicators from 10 distinct
perspectives. These metrics provide a multifaceted evaluation, enabling a
nuanced understanding of the LLMs' climate crisis comprehension. The
experimental results demonstrate the efficacy of our proposed method. In our
evaluation utilizing diverse high-performing LLMs, we discovered that while
LLMs possess considerable climate-related knowledge, there are shortcomings in
terms of timeliness, indicating a need for continuous updating and refinement
of their climate-related content.",http://arxiv.org/abs/2312.11985v3
"Dimensional analysis identifies contrasting dynamics of past climate
  states and critical transitions",2023-09-22T08:05:59Z,"Tommaso Alberti, Fabio Florindo, Eelco J. Rohling, Valerio Lucarini, Davide Faranda","While one can unequivocally identify past climate transitions, we lack
comprehensive knowledge about their underlying mechanisms and timescales. Our
study employs a dimensional analysis of benthic stable isotope records to
uncover, across different timescales, how the climatic fluctuation of the
Cenozoic are associated with changes in the number of effective degrees of
freedom. Precession timescales dominate the Hothouse and Warmhouse states,
while the Icehouse climate is primarily influenced by obliquity and
eccentricity timescales. Notably, the Coolhouse state lacks dominant
timescales. Our analysis proves effective in objectively identifying abrupt
climate shifts and extremes. This is also demonstrated using high-resolution
data from the last glacial cycle, revealing abrupt climate shifts within a
single climate state. These findings significantly impact our understanding of
the inherent stability of each climate state and the evaluation of
(paleo-)climate models' ability to replicate key features of past/future
climate states and transitions.",http://arxiv.org/abs/2309.12693v1
"Dynamic Grouping for Climate Change Negotiation: Facilitating
  Cooperation and Balancing Interests through Effective Strategies",2023-07-26T01:12:44Z,"Duo Zhang, Yuren Pang, Yu Qin","The current framework for climate change negotiation models presents several
limitations that warrant further research and development. In this track, we
discuss mainly two key areas for improvement, focusing on the geographical
impacts and utility framework. In the aspects of geographical impacts, We
explore five critical aspects: (1) the shift from local to global impact, (2)
variability in climate change effects across regions, (3) heterogeneity in
geographical location and political structures, and (4) collaborations between
adjacent nations, (5) the importance of including historical and cultural
factors influencing climate negotiations. Furthermore, we emphasize the need to
refine the utility and rewards framework to reduce the homogeneity and the
level of overestimating the climate mitigation by integrating the positive
effects of saving rates into the reward function and heterogeneity among all
regions. By addressing these limitations, we hope to enhance the accuracy and
effectiveness of climate change negotiation models, enabling policymakers and
stakeholders to devise targeted and appropriate strategies to tackle climate
change at both regional and global levels.",http://arxiv.org/abs/2307.13886v1
Understanding Opinions Towards Climate Change on Social Media,2023-12-02T20:02:34Z,"Yashaswi Pupneja, Joseph Zou, Sacha Lévy, Shenyang Huang","Social media platforms such as Twitter (now known as X) have revolutionized
how the public engage with important societal and political topics. Recently,
climate change discussions on social media became a catalyst for political
polarization and the spreading of misinformation. In this work, we aim to
understand how real world events influence the opinions of individuals towards
climate change related topics on social media. To this end, we extracted and
analyzed a dataset of 13.6 millions tweets sent by 3.6 million users from 2006
to 2019. Then, we construct a temporal graph from the user-user mentions
network and utilize the Louvain community detection algorithm to analyze the
changes in community structure around Conference of the Parties on Climate
Change~(COP) events. Next, we also apply tools from the Natural Language
Processing literature to perform sentiment analysis and topic modeling on the
tweets. Our work acts as a first step towards understanding the evolution of
pro-climate change communities around COP events. Answering these questions
helps us understand how to raise people's awareness towards climate change thus
hopefully calling on more individuals to join the collaborative effort in
slowing down climate change.",http://arxiv.org/abs/2312.01217v1
"Theoretical tools for understanding the climate crisis from Hasselmann's
  program and beyond",2023-03-21T16:46:37Z,"Valerio Lucarini, Mickaël Chekroun","Klaus Hasselmann's revolutionary intuition in climate science was to take
advantage of the stochasticity associated with fast weather processes to probe
the slow dynamics of the climate system. This has led to fundamentally new ways
to study the response of climate models to perturbations, and to perform
detection and attribution for climate change signals. Hasselmann's program has
been extremely influential in climate science and beyond. We first summarise
the main aspects of such a program using modern concepts and tools of
statistical physics and applied mathematics. We then provide an overview of
some promising scientific perspectives that might better clarify the science
behind the climate crisis and that stem from Hasselmann's ideas. We show how to
perform rigorous model reduction by constructing parametrizations in systems
that do not necessarily feature a time-scale separation between unresolved and
resolved processes. We propose a general framework for explaining the
relationship between climate variability and climate change, and for performing
climate change projections. This leads us seamlessly to explain some key
general aspects of climatic tipping points. Finally, we show that response
theory provides a solid framework supporting optimal fingerprinting methods for
detection and attribution.",http://arxiv.org/abs/2303.12009v3
"Climate uncertainty impacts on optimal mitigation pathways and social
  cost of carbon",2023-04-18T12:47:51Z,"Christopher J. Smith, Alaa Al Khourdajie, Pu Yang, Doris Folini","Emissions pathways used in climate policy analysis are often derived from
integrated assessment models. However, such emissions pathways do not typically
include climate feedbacks on socioeconomic systems and by extension do not
consider climate uncertainty in their construction. We use a well-known
cost-benefit integrated assessment model, the Dynamic Integrated
Climate-Economy (DICE) model, with its climate component replaced by the
Finite-amplitude Impulse Response (FaIR) model (v2.1). The climate uncertainty
in FaIR is sampled with an ensemble that is consistent with historically
observed climate and Intergovernmental Panel on Climate Change (IPCC) assessed
ranges of key climate variables such as equilibrium climate sensitivity. Three
scenarios are produced: a pathway similar to the ""optimal welfare"" scenario of
DICE that has similar warming outcomes to current policies, and pathways that
limit warming to ""well-below"" 2C and 1.5C with low overshoot, in line with
Paris Agreement long-term temperature goals. Climate uncertainty alone is
responsible for a factor of five variation (5-95% range) in the social cost of
carbon in the 1.5C scenario. CO2 emissions trajectories resulting from the
optimal level of emissions abatement in all pathways are also sensitive to
climate uncertainty, with 2050 emissions ranging from -12 to +14 GtCO2/yr in
the 1.5C scenario. Equilibrium climate sensitivity and the strength of
present-day aerosol effective radiative forcing are strong determinants of
social cost of carbon and mid-century CO2 emissions. This shows that narrowing
climate uncertainty leads to more refined estimates for the social cost of
carbon and provides more certainty about the optimal rate of emissions
abatement. Including climate and climate uncertainty in integrated assessment
model derived emissions scenarios would address a key missing feedback in
scenario construction.",http://arxiv.org/abs/2304.08957v3
"Towards Answering Climate Questionnaires from Unstructured Climate
  Reports",2023-01-11T00:22:56Z,"Daniel Spokoyny, Tanmay Laud, Tom Corringham, Taylor Berg-Kirkpatrick","The topic of Climate Change (CC) has received limited attention in NLP
despite its urgency. Activists and policymakers need NLP tools to effectively
process the vast and rapidly growing unstructured textual climate reports into
structured form. To tackle this challenge we introduce two new large-scale
climate questionnaire datasets and use their existing structure to train
self-supervised models. We conduct experiments to show that these models can
learn to generalize to climate disclosures of different organizations types
than seen during training. We then use these models to help align texts from
unstructured climate documents to the semi-structured questionnaires in a human
pilot study. Finally, to support further NLP research in the climate domain we
introduce a benchmark of existing climate text classification datasets to
better evaluate and compare existing models.",http://arxiv.org/abs/2301.04253v2
"Contemporary climate analogs project north-south polarization of urban
  water-energy nexus across US cities under warming climate",2023-06-29T15:52:44Z,"Renee Obringer, Roshanak Nateghi, Jessica Knee, Kaveh Madani, Rohini Kumar","Despite the coupled nature of water and electricity demand, the two utilities
are often managed by different entities with minimal interaction. Neglecting
the water-energy demand nexus leads to to suboptimal management decisions,
particularly under climate change. Here, we leverage state-of-the-art machine
learning and contemporary climate analogs to project the city-level coupled
water and electricity demand of 46 major U.S. cities into the future. The
results show that many U.S. cities may experience an increase in electricity
(water) demand of up to 20% (15%) due to climate change under a high emissions
scenario, with a clear north-south gradient. In the absence of appropriate
mitigation strategies, these changes will likely stress current infrastructure,
limiting the effectiveness of the ongoing grid decarbonization efforts. In the
event that cities are unable to match the increasing demand, there may be
increased occurrence of supply shortages, leading to blackouts with
disproportionate impacts on vulnerable populations. As such, reliable
projections of future water and electricity demand under climate change are
critical not only for preventing further exacerbation of the existing
environmental injustices but also for more effective design and execution of
climate change mitigation and adaptation plans.",http://arxiv.org/abs/2306.17050v1
Quantum Machine Learning in Climate Change and Sustainability: a Review,2023-10-13T14:56:38Z,"Amal Nammouchi, Andreas Kassler, Andreas Theorachis","Climate change and its impact on global sustainability are critical
challenges, demanding innovative solutions that combine cutting-edge
technologies and scientific insights. Quantum machine learning (QML) has
emerged as a promising paradigm that harnesses the power of quantum computing
to address complex problems in various domains including climate change and
sustainability. In this work, we survey existing literature that applies
quantum machine learning to solve climate change and sustainability-related
problems. We review promising QML methodologies that have the potential to
accelerate decarbonization including energy systems, climate data forecasting,
climate monitoring, and hazardous events predictions. We discuss the challenges
and current limitations of quantum machine learning approaches and provide an
overview of potential opportunities and future work to leverage QML-based
methods in the important area of climate change research.",http://arxiv.org/abs/2310.09162v1
"Adapting to climate change: Long-term impact of wind resource changes on
  China's power system resilience",2023-11-28T07:29:33Z,"Jiaqi Ruan, Xiangrui Meng, Yifan Zhu, Gaoqi Liang, Xianzhuo Sun, Huayi Wu, Huijuan Xiao, Mengqian Lu, Pin Gao, Jiapeng Li, Wai-Kin Wong, Zhao Xu, Junhua Zhao","Modern society's reliance on power systems is at risk from the escalating
effects of wind-related climate change. Yet, failure to identify the intricate
relationship between wind-related climate risks and power systems could lead to
serious short- and long-term issues, including partial or complete blackouts.
Here, we develop a comprehensive framework to assess China's power system
resilience across various climate change scenarios, enabling a holistic
evaluation of the repercussions induced by wind-related climate change. Our
findings indicate that China's current wind projects and planning strategies
could be jeopardized by wind-related climate change, with up to a 12\% decline
in regional wind power availability. Moreover, our results underscore a
pronounced vulnerability of power system resilience amidst the rigors of
hastened climate change, unveiling a potential amplification of resilience
deterioration, even approaching fourfold by 2060 under the most severe
scenario, relative to the 2020 benchmark. This work advocates for strategic
financial deployment within the power sector aimed at climate adaptation,
enhancing power system resilience to avert profound losses from long-term,
wind-influenced climatic fluctuations.",http://arxiv.org/abs/2311.16572v2
"ClimateX: Do LLMs Accurately Assess Human Expert Confidence in Climate
  Statements?",2023-11-28T10:26:57Z,"Romain Lacombe, Kerrie Wu, Eddie Dilworth","Evaluating the accuracy of outputs generated by Large Language Models (LLMs)
is especially important in the climate science and policy domain. We introduce
the Expert Confidence in Climate Statements (ClimateX) dataset, a novel,
curated, expert-labeled dataset consisting of 8094 climate statements collected
from the latest Intergovernmental Panel on Climate Change (IPCC) reports,
labeled with their associated confidence levels. Using this dataset, we show
that recent LLMs can classify human expert confidence in climate-related
statements, especially in a few-shot learning setting, but with limited (up to
47%) accuracy. Overall, models exhibit consistent and significant
over-confidence on low and medium confidence statements. We highlight
implications of our results for climate communication, LLMs evaluation
strategies, and the use of LLMs in information retrieval systems.",http://arxiv.org/abs/2311.17107v1
"Sea level Projections with Machine Learning using Altimetry and Climate
  Model ensembles",2023-08-02T19:18:38Z,"Saumya Sinha, John Fasullo, R. Steven Nerem, Claire Monteleoni","Satellite altimeter observations retrieved since 1993 show that the global
mean sea level is rising at an unprecedented rate (3.4mm/year). With almost
three decades of observations, we can now investigate the contributions of
anthropogenic climate-change signals such as greenhouse gases, aerosols, and
biomass burning in this rising sea level. We use machine learning (ML) to
investigate future patterns of sea level change. To understand the extent of
contributions from the climate-change signals, and to help in forecasting sea
level change in the future, we turn to climate model simulations. This work
presents a machine learning framework that exploits both satellite observations
and climate model simulations to generate sea level rise projections at a
2-degree resolution spatial grid, 30 years into the future. We train fully
connected neural networks (FCNNs) to predict altimeter values through a
non-linear fusion of the climate model hindcasts (for 1993-2019). The learned
FCNNs are then applied to future climate model projections to predict future
sea level patterns. We propose segmenting our spatial dataset into meaningful
clusters and show that clustering helps to improve predictions of our ML model.",http://arxiv.org/abs/2308.02460v1
