Title,Published,Authors,Abstract,Link
"Soil Organic Carbon Estimation from Climate-related Features with Graph
  Neural Network",2023-11-27T16:25:12Z,"Weiying Zhao, Natalia Efremova","Soil organic carbon (SOC) plays a pivotal role in the global carbon cycle,
impacting climate dynamics and necessitating accurate estimation for
sustainable land and agricultural management. While traditional methods of SOC
estimation face resolution and accuracy challenges, recent technological
solutions harness remote sensing, machine learning, and high-resolution
satellite mapping. Graph Neural Networks (GNNs), especially when integrated
with positional encoders, can capture complex relationships between soil and
climate. Using the LUCAS database, this study compared four GNN operators in
the positional encoder framework. Results revealed that the PESAGE and
PETransformer models outperformed others in SOC estimation, indicating their
potential in capturing the complex relationship between SOC and climate
features. Our findings confirm the feasibility of applications of GNN
architectures in SOC prediction, establishing a framework for future
explorations of this topic with more advanced GNN models.",http://arxiv.org/abs/2311.15979v1
"Mapping Housing Stock Characteristics from Drone Images for Climate
  Resilience in the Caribbean",2023-12-16T03:49:40Z,"Isabelle Tingzon, Nuala Margaret Cowan, Pierre Chrzanowski","Comprehensive information on housing stock is crucial for climate adaptation
initiatives aiming to reduce the adverse impacts of climate-extreme hazards in
high-risk regions like the Caribbean. In this study, we propose a workflow for
rapidly generating critical baseline housing stock data using very
high-resolution drone images and deep learning techniques. Specifically, our
work leverages the Segment Anything Model and convolutional neural networks for
the automated generation of building footprints and roof classification maps.
By strengthening local capacity within government agencies to leverage AI and
Earth Observation-based solutions, this work seeks to improve the climate
resilience of the housing sector in small island developing states in the
Caribbean.",http://arxiv.org/abs/2312.10306v1
Habitat fragmentation affects climate adaptation in a forest herb,2023-03-28T03:47:39Z,"Frederik Van Daele, Olivier Honnay, Steven Janssens, Hanne De Kort","Climate change and the resulting increased drought frequencies pose
considerable threats to forest herb populations, especially when compounded by
additional environmental challenges. Specifically, habitat fragmentation may
disrupt climate adaptation and cause shifts in mating systems. To examine this,
we conducted a garden experiment with Primula elatior offspring from 24
populations across a climate and landscape fragmentation gradient. We evaluated
vegetative, regulatory, and reproductive traits under different soil moisture
regimes, assessing local adaptation and phenotypic plasticity. We also
conducted a field study in 60 populations along the same gradient to examine
potential breakdown of reciprocal herkogamy. Our results showed an evolutionary
shift from drought avoidance in southern populations to drought tolerance in
northern populations for large, connected populations. However, fragmentation
disrupted climate clines and adaptive responses to drought in key traits
related to growth, biomass allocation and water regulation. Our findings also
indicate the beginning of an evolutionary breakdown in reciprocal herkogamy.
These disruptions resulted in significantly reduced flowering investment,
especially in southern fragmented populations. These findings provide new
evidence of how habitat fragmentation disrupts climate adaptation and drought
tolerance in Primula elatior, emphasizing the need to account for habitat
fragmentation in conservation strategies to preserve resilient forest herb
populations amidst global changes.",http://arxiv.org/abs/2303.15712v3
"Multi-fidelity climate model parameterization for better generalization
  and extrapolation",2023-09-19T01:03:39Z,"Mohamed Aziz Bhouri, Liran Peng, Michael S. Pritchard, Pierre Gentine","Machine-learning-based parameterizations (i.e. representation of sub-grid
processes) of global climate models or turbulent simulations have recently been
proposed as a powerful alternative to physical, but empirical, representations,
offering a lower computational cost and higher accuracy. Yet, those approaches
still suffer from a lack of generalization and extrapolation beyond the
training data, which is however critical to projecting climate change or
unobserved regimes of turbulence. Here we show that a multi-fidelity approach,
which integrates datasets of different accuracy and abundance, can provide the
best of both worlds: the capacity to extrapolate leveraging the
physically-based parameterization and a higher accuracy using the
machine-learning-based parameterizations. In an application to climate
modeling, the multi-fidelity framework yields more accurate climate projections
without requiring major increase in computational resources. Our multi-fidelity
randomized prior networks (MF-RPNs) combine physical parameterization data as
low-fidelity and storm-resolving historical run's data as high-fidelity. To
extrapolate beyond the training data, the MF-RPNs are tested on high-fidelity
warming scenarios, $+4K$, data. We show the MF-RPN's capacity to return much
more skillful predictions compared to either low- or high-fidelity (historical
data) simulations trained only on one regime while providing trustworthy
uncertainty quantification across a wide range of scenarios. Our approach paves
the way for the use of machine-learning based methods that can optimally
leverage historical observations or high-fidelity simulations and extrapolate
to unseen regimes such as climate change.",http://arxiv.org/abs/2309.10231v1
"Large Scale Masked Autoencoding for Reducing Label Requirements on SAR
  Data",2023-10-02T00:11:47Z,"Matt Allen, Francisco Dorr, Joseph A. Gallego-Mejia, Laura Martínez-Ferrer, Anna Jungbluth, Freddie Kalaitzis, Raúl Ramos-Pollán","Satellite-based remote sensing is instrumental in the monitoring and
mitigation of the effects of anthropogenic climate change. Large scale, high
resolution data derived from these sensors can be used to inform intervention
and policy decision making, but the timeliness and accuracy of these
interventions is limited by use of optical data, which cannot operate at night
and is affected by adverse weather conditions. Synthetic Aperture Radar (SAR)
offers a robust alternative to optical data, but its associated complexities
limit the scope of labelled data generation for traditional deep learning. In
this work, we apply a self-supervised pretraining scheme, masked autoencoding,
to SAR amplitude data covering 8.7\% of the Earth's land surface area, and tune
the pretrained weights on two downstream tasks crucial to monitoring climate
change - vegetation cover prediction and land cover classification. We show
that the use of this pretraining scheme reduces labelling requirements for the
downstream tasks by more than an order of magnitude, and that this pretraining
generalises geographically, with the performance gain increasing when tuned
downstream on regions outside the pretraining set. Our findings significantly
advance climate change mitigation by facilitating the development of task and
region-specific SAR models, allowing local communities and organizations to
deploy tailored solutions for rapid, accurate monitoring of climate change
effects.",http://arxiv.org/abs/2310.00826v4
"Bayesian Optimisation Against Climate Change: Applications and
  Benchmarks",2023-06-07T11:17:07Z,"Sigrid Passano Hellan, Christopher G. Lucas, Nigel H. Goddard","Bayesian optimisation is a powerful method for optimising black-box
functions, popular in settings where the true function is expensive to evaluate
and no gradient information is available. Bayesian optimisation can improve
responses to many optimisation problems within climate change for which
simulator models are unavailable or expensive to sample from. While there have
been several feasibility demonstrations of Bayesian optimisation in
climate-related applications, there has been no unifying review of applications
and benchmarks. We provide such a review here, to encourage the use of Bayesian
optimisation in important and well-suited application domains. We identify four
main application domains: material discovery, wind farm layout, optimal
renewable control and environmental monitoring. For each domain we identify a
public benchmark or data set that is easy to use and evaluate systems against,
while being representative of real-world problems. Due to the lack of a
suitable benchmark for environmental monitoring, we propose LAQN-BO, based on
air pollution data. Our contributions are: a) identifying a representative
range of benchmarks, providing example code where necessary; b) introducing a
new benchmark, LAQN-BO; and c) promoting a wider use of climate change
applications among Bayesian optimisation practitioners.",http://arxiv.org/abs/2306.04343v1
"Heterogeneous Vulnerability of Zero-Carbon Power Grids under
  Climate-Technological Changes",2023-07-18T18:36:37Z,"M. Vivienne Liu, Vivek Srikrishnan, Kenji Doering, Elnaz Kabir, Scott Steinschneider, C. Lindsay Anderson","The transition to decarbonized energy systems has become a priority globally
to mitigate carbon emissions and, therefore, climate change. However, the
vulnerabilities of zero-carbon power grids under climatic and technological
changes have not been thoroughly examined. In this study, we focus on modeling
the zero-carbon grid using a dataset that captures diverse future
climatic-technological scenarios, with New York State as a case study. By
accurately representing the topology and operational constraints of the power
grid, we identify spatiotemporal heterogeneity in vulnerabilities arising from
the interplay of renewable resource availability, high load, and severe
transmission line congestion. Our findings reveal a need for 61-105\% more
firm, zero-emission capacity to ensure system reliability. Merely increasing
wind and solar capacity is ineffective in improving reliability due to
transmission congestion and spatiotemporal variations in vulnerabilities. This
underscores the importance of considering spatiotemporal dynamics and
operational constraints when making decisions regarding additional investments
in renewable resources.",http://arxiv.org/abs/2307.15079v3
Optimizing Climate Policy through C-ROADS and En-ROADS Analysis,2023-11-06T21:30:58Z,Iveena Mukherjee,"With the onset of climate change and the increasing need for effective
policies, a multilateral approach is needed to make an impact on the growing
threats facing the environment. Through the use of systematic analysis by way
of C-ROADS and En-ROADS, numerous scenarios have been simulated to shed light
on the most imperative policy factors to mitigate climate change. Within
C-ROADS, it was determined that the impacts of the shrinking ice-albedo effect
on global temperatures is significant, however differential sea ice melting
between the poles may not impact human dwellings, as all regions are impacted
by sea ice melt. Flood risks are also becoming more imminent, specifically in
high population density areas. In terms of afforestation, China is the emerging
leader, and if other countries follow suit, this can incur substantial
dividends. Upon conducting a comprehensive analysis of global trends through
En-ROADS, intriguing patterns appear between the length of a policy initiative,
and its effectiveness. Quick policies with gradual increases in taxation proved
successful. Government intervention was also favorable, however an optimized
model is presented, with moderate subsidization of renewable energy. Through
this systematic analysis of assumptions and policy for effective climate change
mitigation efforts, an optimized, economically-favorable solution arises.",http://arxiv.org/abs/2311.03546v1
Wavelet Coherence Of Total Solar Irradiance and Atlantic Climate,2023-05-03T17:59:05Z,"Vasil Kolev, Yavor Chapanov","The oscillations of climatic parameters of North Atlantic Ocean play
important role in various events in North America and Europe. Several climatic
indices are associated with these oscillations. The long term Atlantic
temperature anomalies are described by the Atlantic Multidecadal Oscillation
(AMO). The Atlantic Multidecadal Oscillation also known as Atlantic
Multidecadal Variability (AMV), is the variability of the sea surface
temperature (SST) of the North Atlantic Ocean at the timescale of several
decades. The AMO is correlated to air temperatures and rainfall over much of
the Northern Hemisphere, in particular in the summer climate in North America
and Europe. The long-term variations of surface temperature are driven mainly
by the cycles of solar activity, represented by the variations of the Total
Solar Irradiance (TSI). The frequency and amplitude dependences between the TSI
and AMO are analyzed by wavelet coherence of millennial time series since 800
AD till now. The results of wavelet coherence are compared with the detected
common solar and climate cycles in narrow frequency bands by the method of
Partial Fourier Approximation. The long-term coherence between TSI and AMO can
help to understand better the recent climate change and can improve the long
term forecast.",http://arxiv.org/abs/2305.02319v1
"Transferability and explainability of deep learning emulators for
  regional climate model projections: Perspectives for future applications",2023-11-01T00:44:39Z,"Jorge Bano-Medina, Maialen Iturbide, Jesus Fernandez, Jose Manuel Gutierrez","Regional climate models (RCMs) are essential tools for simulating and
studying regional climate variability and change. However, their high
computational cost limits the production of comprehensive ensembles of regional
climate projections covering multiple scenarios and driving Global Climate
Models (GCMs) across regions. RCM emulators based on deep learning models have
recently been introduced as a cost-effective and promising alternative that
requires only short RCM simulations to train the models. Therefore, evaluating
their transferability to different periods, scenarios, and GCMs becomes a
pivotal and complex task in which the inherent biases of both GCMs and RCMs
play a significant role. Here we focus on this problem by considering the two
different emulation approaches proposed in the literature (PP and MOS,
following the terminology introduced in this paper). In addition to standard
evaluation techniques, we expand the analysis with methods from the field of
eXplainable Artificial Intelligence (XAI), to assess the physical consistency
of the empirical links learnt by the models. We find that both approaches are
able to emulate certain climatological properties of RCMs for different periods
and scenarios (soft transferability), but the consistency of the emulation
functions differ between approaches. Whereas PP learns robust and physically
meaningful patterns, MOS results are GCM-dependent and lack physical
consistency in some cases. Both approaches face problems when transferring the
emulation function to other GCMs, due to the existence of GCM-dependent biases
(hard transferability). This limits their applicability to build ensembles of
regional climate projections. We conclude by giving some prospects for future
applications.",http://arxiv.org/abs/2311.03378v1
"Distribution System Operation Amidst Wildfire-Prone Climate Conditions
  Under Decision-Dependent Line Availability Uncertainty",2023-06-10T03:03:08Z,"Alexandre Moreira, Felipe Pianco, Bruno Fanzeres, Alexandre Street, Ruiwei Jiang, Chaoyue Zhao, Miguel Heleno","Wildfires can severely damage electricity grids leading to long periods of
power interruption. Climate change will exacerbate this threat by increasing
the frequency of dry climate conditions. Under these climate conditions,
human-related actions that initiate wildfires should be avoided, including
those induced by power systems operation. In this paper, we propose a novel
optimization model that is capable of determining appropriate network topology
changes (via switching actions) to alleviate the levels of power flows through
vulnerable parts of the grid so as to decrease the probability of wildfire
ignition. Within this framework, the proposed model captures the relationship
between failure probabilities and line-flow decisions by explicitly considering
the former as a function of the latter. The resulting formulation is a
two-stage model with endogenous decision-dependent probabilities, where the
first stage determines the optimal switching actions and the second stage
evaluates the worst-case expected operation cost. We propose an exact iterative
method to deal with this intricate problem and the methodology is illustrated
with a 54-bus and a 138-bus distribution system.",http://arxiv.org/abs/2306.06336v1
"Detangling the role of climate in vegetation productivity with an
  explainable convolutional neural network",2023-10-28T13:04:30Z,"Ricardo Barros Lourenço, Michael J. Smith, Sylvia Smullin, Umangi Jain, Alemu Gonsamo, Arthur Ouaknine","Forests of the Earth are a vital carbon sink while providing an essential
habitat for biodiversity. Vegetation productivity (VP) is a critical indicator
of carbon uptake in the atmosphere. The leaf area index is a crucial vegetation
index used in VP estimation. This work proposes to predict the leaf area index
(LAI) using climate variables to better understand future productivity
dynamics; our approach leverages the capacities of the V-Net architecture for
spatiotemporal LAI prediction. Preliminary results are well-aligned with
established quality standards of LAI products estimated from Earth observation
data. We hope that this work serves as a robust foundation for subsequent
research endeavours, particularly for the incorporation of prediction
attribution methodologies, which hold promise for elucidating the underlying
climate change drivers of global vegetation productivity.",http://arxiv.org/abs/2310.18703v1
"Analyzing the impact of climate change on critical infrastructure from
  the scientific literature: A weakly supervised NLP approach",2023-02-03T17:47:42Z,"Tanwi Mallick, Joshua David Bergerson, Duane R. Verner, John K Hutchison, Leslie-Anne Levy, Prasanna Balaprakash","Natural language processing (NLP) is a promising approach for analyzing large
volumes of climate-change and infrastructure-related scientific literature.
However, best-in-practice NLP techniques require large collections of relevant
documents (corpus). Furthermore, NLP techniques using machine learning and deep
learning techniques require labels grouping the articles based on user-defined
criteria for a significant subset of a corpus in order to train the supervised
model. Even labeling a few hundred documents with human subject-matter experts
is a time-consuming process. To expedite this process, we developed a weak
supervision-based NLP approach that leverages semantic similarity between
categories and documents to (i) establish a topic-specific corpus by subsetting
a large-scale open-access corpus and (ii) generate category labels for the
topic-specific corpus. In comparison with a months-long process of
subject-matter expert labeling, we assign category labels to the whole corpus
using weak supervision and supervised learning in about 13 hours. The labeled
climate and NCF corpus enable targeted, efficient identification of documents
discussing a topic (or combination of topics) of interest and identification of
various effects of climate change on critical infrastructure, improving the
usability of scientific literature and ultimately supporting enhanced policy
and decision making. To demonstrate this capability, we conduct topic modeling
on pairs of climate hazards and NCFs to discover trending topics at the
intersection of these categories. This method is useful for analysts and
decision-makers to quickly grasp the relevant topics and most important
documents linked to the topic.",http://arxiv.org/abs/2302.01887v2
"Climate change adaptation stories: co-creating climate services with
  reindeer herders in Finland",2023-11-22T23:29:35Z,"Marta Terrado, Nuria Pérez-Zanón, Dragana Bojovic, Nube González-Reviriego, Gerrit Versteeg, Sara Octenjak, Albert Martínez-Botí, Tanja Joona","Reindeer husbandry in the Arctic region is strongly affected by the local
climate. Reindeer herders are used to coping with adverse weather, climate, and
grazing conditions through autonomous adaptation. However, todays rapidly
changing Arctic environment poses new challenges to the management of herding
activities. Finding means for combining traditional and scientific knowledge
without depriving any of the systems of its fundamental strengths is hence
deemed necessary. We apply a transdisciplinary framework for knowledge
co-production involving international researchers and reindeer herders from
different cooperatives in northern Finland. Through climate change adaptation
stories, we co-explore how climate predictions can inform herders decision
making during the herding season. Relevant decisions include the anticipation
of summer harvest time, the inopportune periods of cold weather in spring, and
insect harassment in summer. The analysis of two different adaptation stories
shows that seasonal predictions of temperature for May and June can
successfully advise about the likelihood of having an earlier than normal
harvest. Likewise, sub-seasonal predictions of temperature during April and May
can be useful to anticipate the occurrence of backwinter episodes, which can
support herders in deciding whether to feed reindeer in pens for longer,
avoiding putting the survival of calves at risk. This study, which would
benefit from co-evaluation in real world settings and consideration of
additional adaptation stories, sets the basis for a successful co-production of
climate services with Arctic reindeer herders. This research shows the
potential to enhance the resilience of Polar regions, offering opportunities
for adaptation while supporting the sustainability and culture of traditional
practices of Arctic communities.",http://arxiv.org/abs/2311.13734v1
Impact of Changing Greenhouse Gas Concentrations on Ontario's Climate,2023-05-09T14:51:47Z,W. A. van Wijngaarden,"The effect of changing greenhouse gas concentrations on climate was examined.
Calculations of the climate sensitivity, the warming of the Earth due to a
doubling of atmospheric CO2, are discussed. Ontario was responsible for 0.35%
of the world's CO2 emissions in 2019 and this amount was 20% lower than in
2005. The predictions of Global Climate Models (GCM) were compared to
observations. Records since 1880 show an overall warming of about 1 C. The GCMs
do not account for observed decadal temperature fluctuations and consistently
overestimate the warming. Ontario's contribution to global warming is only 9.2
x 10^{-5} C/year using the Intergovernmental Panel on Climate Change
recommended climate sensitivity value. Measurements of the polar ice caps
reveal a decrease in the minimum September Arctic sea ice extent during
1979-2022 but the trend levelled off after 2007; while the average Antarctic
sea ice extent slightly increased. Sea level increased slightly throughout the
20th century. Ontario's contribution to anthropogenic sea level rise is about
0.005 mm/year. Sea level along Ontario's Hudson Bay coast is decreasing due to
isostatic rebound of the land following the last Ice Age. The change to ocean
acidity due to CO2 absorption from the atmosphere is negligible compared to
that due to tides, ocean depth and seasonal effects. Ontario's contribution to
ocean acidification is estimated to be 6 x 10^{-6} pH/year. No changes in
precipitation in North America over the 19th and 20th centuries, nor at Toronto
since 1843, were found. The Great Lake levels are remarkably constant over the
past century showing no evidence of a change in the incidence of flooding. No
evidence was found that the frequency of extreme events such as hurricanes or
tornadoes increased during recent decades. The number of forest fires in Canada
and Ontario decreased during 1990 to 2020.",http://arxiv.org/abs/2305.05500v1
